{
  "version": "1.0",
  "style_playbook": "flat-motion-graphics",
  "scenes": [
    {
      "id": "scene-1",
      "type": "text_card",
      "description": "Opening hero title: 'Photosynthesis in 30 Seconds' with leaf icon pulse on dark slate background. Subtitle fades in: 'Sunlight In, Life Out'. Spring bounce entrance per playbook.",
      "start_seconds": 0,
      "end_seconds": 5,
      "script_section_id": "s1",
      "framing": "full-screen centered title stack, leaf icon above headline",
      "movement": "title scale-up bounce (0.8→1.05→1.0); subtitle fade-up 0.4s after title lands; leaf icon gentle pulse loop",
      "transition_in": "zoom-in",
      "transition_out": "wipe-left",
      "overlay_notes": "Remotion cut type: hero_title. text='Photosynthesis in 30 Seconds', subtitle='Sunlight In, Life Out'. Accent #7C3AED, bg #0F172A.",
      "shot_intent": "Stop-scroll hook — promise a complete mental model in one watch.",
      "narrative_role": "establish_context",
      "information_role": "Viewer knows topic and duration contract.",
      "hero_moment": false,
      "texture_keywords": ["flat", "geometric", "neon-accent"],
      "required_assets": []
    },
    {
      "id": "scene-2",
      "type": "diagram",
      "description": "Diagram Reveal: stylized chloroplast cross-section. Sun rays enter from upper-left; chlorophyll discs glow #7C3AED as light hits. Progressive build — outer membrane first, then thylakoid stacks, then light arrows.",
      "start_seconds": 5,
      "end_seconds": 10,
      "script_section_id": "s2",
      "framing": "full-screen diagram centered, sun icon offset upper-left",
      "movement": "progressive reveal left-to-right; glow pulse on chlorophyll when narrator says 'chlorophyll'",
      "transition_in": "wipe-left",
      "transition_out": "morph",
      "overlay_notes": "Lower-third key term chip: 'Chloroplast' at 6s. Neon outlines on #0F172A per playbook diagram_style.",
      "shot_intent": "Zoom into the cellular engine where light is captured.",
      "narrative_role": "introduce_subject",
      "information_role": "Viewer sees where photosynthesis happens inside the leaf.",
      "hero_moment": false,
      "texture_keywords": ["neon-outline", "diagram", "glowing"],
      "required_assets": [
        {
          "type": "diagram",
          "description": "Mermaid flowchart LR: Sunlight → Chlorophyll (in Chloroplast) → Light Energy. Neon purple/teal palette on dark slate. Rounded rectangles, glowing edges.",
          "source": "generate"
        }
      ]
    },
    {
      "id": "scene-3",
      "type": "animation",
      "description": "Kinetic equation beat 1: H₂O molecule icon at center splits into H + O fragments; O₂ pair forms and floats upward with cyan (#06B6D4) glow trail. Matches 'light splits water apart'.",
      "start_seconds": 10,
      "end_seconds": 14,
      "script_section_id": "s3",
      "framing": "centered molecule, O₂ exits upward into upper third",
      "movement": "H2O shake → crack → split animation; O2 molecules rise with spring overshoot",
      "transition_in": "morph",
      "transition_out": "cut",
      "overlay_notes": "Icon labels: H₂O (before split), O₂ (after). Remotion text_card chips for molecule names.",
      "shot_intent": "Make invisible chemistry tangible — water becomes breathable oxygen.",
      "narrative_role": "deliver_payload",
      "information_role": "Viewer understands light reactions release O₂ from water.",
      "hero_moment": false,
      "texture_keywords": ["flat-icons", "spring-motion", "particle-glow"],
      "required_assets": []
    },
    {
      "id": "scene-4",
      "type": "text_card",
      "description": "O₂ payoff card: large 'O₂' stat with subtitle 'Released into the air you breathe'. Cyan accent pop with subtle particle float in background.",
      "start_seconds": 14,
      "end_seconds": 17,
      "script_section_id": "s3",
      "framing": "full-screen stat centered",
      "movement": "stat scale-up bounce; subtitle fade-in 0.3s delayed",
      "transition_in": "cut",
      "transition_out": "wipe-left",
      "overlay_notes": "Remotion cut type: stat_card. stat='O₂', subtitle='Released into the air you breathe'. accentColor=#06B6D4.",
      "shot_intent": "Connect abstract reaction to the listener's body.",
      "narrative_role": "emotional_beat",
      "information_role": "Viewer feels personal stake in the oxygen output.",
      "hero_moment": false,
      "texture_keywords": ["bold-type", "stat-reveal"],
      "required_assets": []
    },
    {
      "id": "scene-5",
      "type": "animation",
      "description": "Kinetic equation beat 2: CO₂ molecules (gray dots) flow from right into leaf silhouette; glucose hexagon assembles at center with pink (#EC4899) accent. Arrows show carbon fixation.",
      "start_seconds": 17,
      "end_seconds": 21,
      "script_section_id": "s4",
      "framing": "leaf silhouette center, CO₂ enters from right edge",
      "movement": "CO2 stream particles → hexagon builds vertex-by-vertex; 'sugar' label snaps in on completion",
      "transition_in": "wipe-left",
      "transition_out": "morph",
      "overlay_notes": "Label chip 'Plant fuel' appears when hexagon completes.",
      "shot_intent": "Show the second half of the equation — air becomes food.",
      "narrative_role": "deliver_payload",
      "information_role": "Viewer sees CO₂ fixed into sugar inside the leaf.",
      "hero_moment": false,
      "texture_keywords": ["particle-flow", "geometric", "hexagon"],
      "required_assets": []
    },
    {
      "id": "scene-6",
      "type": "text_card",
      "description": "Inputs recap card: three icon chips slide in sequentially — ☀ Sunlight, 💧 Water, 🌫 CO₂ — with labels. Builds anticipation for equation summary.",
      "start_seconds": 21,
      "end_seconds": 24,
      "script_section_id": "s4",
      "framing": "horizontal icon row centered in middle third",
      "movement": "staggered slide-in left with 0.2s offset per chip",
      "transition_in": "morph",
      "transition_out": "zoom-in",
      "overlay_notes": "text_card sequence; purple borders #7C3AED on each chip.",
      "shot_intent": "Prime the viewer for the in/out equation rhythm.",
      "narrative_role": "transition",
      "information_role": "Viewer inventories the three inputs before the landing.",
      "hero_moment": false,
      "texture_keywords": ["icon-row", "staggered-entrance"],
      "required_assets": []
    },
    {
      "id": "scene-7",
      "type": "text_card",
      "description": "Equation landing hero: full equation '6CO₂ + 6H₂O + light → C₆H₁₂O₆ + 6O₂' with tagline 'Life's solar engine'. Split layout — inputs left (purple), outputs right (cyan). Mic-drop scale emphasis on final line.",
      "start_seconds": 24,
      "end_seconds": 30,
      "script_section_id": "s5",
      "framing": "equation centered, tagline below in smaller weight",
      "movement": "equation draws in line-by-line; tagline fades up at 27s; gentle hold to 30s",
      "transition_in": "zoom-in",
      "transition_out": "cut",
      "overlay_notes": "Remotion cut type: stat_card. stat='6CO₂ + 6H₂O + light → C₆H₁₂O₆ + 6O₂', subtitle='Life's solar engine'. Hero moment — max visual weight.",
      "shot_intent": "Deliver the aha — one equation, whole process.",
      "narrative_role": "resolution",
      "information_role": "Viewer leaves with the complete photosynthesis mental model.",
      "hero_moment": true,
      "texture_keywords": ["equation", "split-complementary", "finale"],
      "required_assets": []
    }
  ],
  "metadata": {
    "total_duration_seconds": 30,
    "scene_count": 7,
    "scene_types_used": ["text_card", "diagram", "animation"],
    "visual_techniques": ["diagram_reveal", "stat_card_punch", "timeline_progression", "kinetic_equation_build"],
    "playbook_colors": {
      "primary": "#7C3AED",
      "accent_cyan": "#06B6D4",
      "accent_pink": "#EC4899",
      "background": "#0F172A",
      "text": "#F8FAFC"
    },
    "feasibility_notes": "All scenes render via Remotion native components + diagram_gen (Mermaid). No FLUX images required for standard path."
  }
}
